{
  "schema_version": "agent-quality-scorecard.v1",
  "as_of_date": "2026-05-29",
  "sources": {
    "feature_spine": "docs/agent-feature-spine.json",
    "telemetry_jsonl": "docs/agent-telemetry.v1.jsonl",
    "scorecard_markdown": "docs/agent-quality-scorecard.md"
  },
  "telemetry_summary": {
    "total_entries": 68,
    "validation_results": {
      "passed": 60,
      "passed_after_repair": 8,
      "failed": 0,
      "blocked": 0
    },
    "state_updates": 68,
    "feature_traceable_entries": 68,
    "task_types": {
      "code/ci/docs/runtime": 1,
      "code/docs/process": 1,
      "code/docs/release/process": 1,
      "code/docs/runtime": 2,
      "code/docs/tests/schema": 1,
      "code/release/runtime": 1,
      "code/runtime/docs": 3,
      "code/tests/data/docs": 1,
      "code/tests/docs": 5,
      "code/tests/docs/state": 1,
      "code/tests/release/docs": 1,
      "code/tests/runtime": 3,
      "code/tests/runtime/docs": 29,
      "code/tests/runtime/research": 1,
      "docs/process": 4,
      "docs/process/ci": 1,
      "docs/process/observability": 6,
      "docs/process/product": 3,
      "prompt/docs": 1,
      "release/runtime": 1,
      "scripts/docs/runtime": 1
    }
  },
  "feature_summary": {
    "total_features": 31,
    "validated_features": 31,
    "referenced_features": 31,
    "referenced_feature_ids": [
      "arch-docx-split",
      "arch-runner-split",
      "bootstrap-contract",
      "canonical-document-package",
      "chunking-and-downstream-handoff",
      "clean-exit-checklist",
      "contracts-stable-v1",
      "docx-native-route",
      "evaluator-rubric",
      "feature-spine",
      "formula-known-patterns-data",
      "formula-recognition-env-config",
      "formula-recognition-postprocess",
      "harness-validator-in-ci",
      "lifecycle-validation",
      "machine-readable-scorecard",
      "machine-readable-telemetry",
      "operator-gui-and-release-packaging",
      "pdf-scan-route",
      "pdf-text-route",
      "quality-and-review-reporting",
      "real-e2e-and-run-validation",
      "resume-dedup-and-queue-state",
      "routing-matrix",
      "run-agent-metadata",
      "semantic-document-metadata",
      "sprint-contract-template",
      "state-layer",
      "validation-document-package",
      "weekly-eval-companion",
      "xlsx-native-route"
    ],
    "referenced_areas": {
      "architecture": 2,
      "contracts": 2,
      "harness": 3,
      "observability": 5,
      "planning": 1,
      "process": 1,
      "product": 13,
      "routing": 1,
      "state": 1,
      "validation": 2
    }
  },
  "observed_signals": [
    {
      "signal_id": "validation-discipline",
      "title": "Validation discipline",
      "score": 5,
      "scale_max": 5,
      "basis": "68/68 telemetry entries have pass-like validation results."
    },
    {
      "signal_id": "state-hygiene",
      "title": "State hygiene",
      "score": 5,
      "scale_max": 5,
      "basis": "68/68 telemetry entries report state_update=true."
    },
    {
      "signal_id": "feature-traceability",
      "title": "Feature traceability",
      "score": 5,
      "scale_max": 5,
      "basis": "68/68 telemetry entries reference at least one feature_id."
    },
    {
      "signal_id": "feature-coverage",
      "title": "Feature coverage in telemetry",
      "score": 5,
      "scale_max": 5,
      "basis": "31/31 validated features are referenced by structured telemetry."
    }
  ]
}
